<?xml version="1.0" encoding="UTF-8"?>
<PathPlan xmlns:xsi="http://www.w3.org/2001/XMLSchema-instance"
 xsi:noNamespaceSchemaLocation="swarmplan.xsd">
    <agents>
        <Plan>
            <head>
                <HeadState ind="50">
                    <State>
                        <TindFrom>0</TindFrom>
                        <TindTo>1</TindTo>
                    </State>
                    <alpha>0</alpha>
                    <beta>0</beta>
                    <gamma>0</gamma>
                    <hx>0</hx>
                    <hy>0</hy>
                    <hz>0</hz>
                </HeadState>
                <HeadState ind="50">
                    <State>
                        <TindFrom>1</TindFrom>
                        <TindTo>3</TindTo>
                    </State>
                    <alpha>0</alpha>
                    <beta>0</beta>
                    <gamma>0</gamma>
                    <hx>0</hx>
                    <hy>0</hy>
                    <hz>0</hz>
                </HeadState>
            </head>
            <mbase>
                <BaseState ind="50">
                    <State>
                        <TindFrom>1</TindFrom>
                        <TindTo>3</TindTo>
                    </State>
                    <bx>0</bx>
                    <by>0</by>
                    <bz>0</bz>
                    <theta>0</theta>
                </BaseState>
                <BaseState ind="50">
                    <State>
                        <TindFrom>1</TindFrom>
                        <TindTo>3</TindTo>
                    </State>
                    <bx>0</bx>
                    <by>0</by>
                    <bz>0</bz>
                    <theta>0</theta>
                </BaseState>
            </mbase>
            <pkm>
                <PkmState ind="50">
                    <State>
                        <TindFrom>0</TindFrom>
                        <TindTo>3</TindTo>
                    </State>
                    <l1>0</l1>
                    <l2>0</l2>
                    <l3>0</l3>
                    <phi>0</phi>
                    <psi1>0</psi1>
                    <psi2>0</psi2>
                    <psi3>0</psi3>
                    <rho>0</rho>
                </PkmState>
                <PkmState ind="50">
                    <State>
                        <TindFrom>1</TindFrom>
                        <TindTo>3</TindTo>
                    </State>
                    <l1>0</l1>
                    <l2>0</l2>
                    <l3>0</l3>
                    <phi>0</phi>
                    <psi1>0</psi1>
                    <psi2>0</psi2>
                    <psi3>0</psi3>
                    <rho>0</rho>
                </PkmState>
            </pkm>
        </Plan>
        <Plan>
            <head>
                <HeadState ind="50">
                    <State>
                        <TindFrom>1</TindFrom>
                        <TindTo>3</TindTo>
                    </State>
                    <alpha>0</alpha>
                    <beta>0</beta>
                    <gamma>0</gamma>
                    <hx>0</hx>
                    <hy>0</hy>
                    <hz>0</hz>
                </HeadState>
                <HeadState ind="50">
                    <State>
                        <TindFrom>1</TindFrom>
                        <TindTo>3</TindTo>
                    </State>
                    <alpha>0</alpha>
                    <beta>0</beta>
                    <gamma>0</gamma>
                    <hx>0</hx>
                    <hy>0</hy>
                    <hz>0</hz>
                </HeadState>
            </head>
            <mbase>
                <BaseState ind="50">
                    <State>
                        <TindFrom>1</TindFrom>
                        <TindTo>50</TindTo>
                    </State>
                    <bx>0</bx>
                    <by>0</by>
                    <bz>0</bz>
                    <theta>0</theta>
                </BaseState>
                <BaseState ind="50">
                    <State>
                        <TindFrom>1</TindFrom>
                        <TindTo>3</TindTo>
                    </State>
                    <bx>0</bx>
                    <by>0</by>
                    <bz>0</bz>
                    <theta>0</theta>
                </BaseState>
            </mbase>
            <pkm>
                <PkmState ind="50">
                    <State>
                        <TindFrom>1</TindFrom>
                        <TindTo>3</TindTo>
                    </State>
                    <l1>0</l1>
                    <l2>0</l2>
                    <l3>0</l3>
                    <phi>0</phi>
                    <psi1>0</psi1>
                    <psi2>0</psi2>
                    <psi3>0</psi3>
                    <rho>0</rho>
                </PkmState>
                <PkmState ind="50">
                    <State>
                        <TindFrom>1</TindFrom>
                        <TindTo>1</TindTo>
                    </State>
                    <l1>0</l1>
                    <l2>0</l2>
                    <l3>0</l3>
                    <phi>0</phi>
                    <psi1>0</psi1>
                    <psi2>0</psi2>
                    <psi3>0</psi3>
                    <rho>0</rho>
                </PkmState>
            </pkm>
        </Plan>
    </agents>
    <D>
        <D>0</D>
        <D>0</D>
    </D>
    <H>
        <H>0</H>
        <H>0</H>
    </H>
    <timePoints>
        <timePoint id="0">1</timePoint>
        <timePoint id="1">1.1</timePoint>
        <timePoint id="2">1.2</timePoint>
        <timePoint id="3">1.3</timePoint>
    </timePoints>
</PathPlan>
